Please advise the official name of your Institution/ Organization and/ or Department / Center:,Do you at faculty level work on common practices addressing the Ethical challenges.  Do you have a common practice for supporting Ethical challenges?,"If yes, please describe here:",Do you at faculty level work on common practice in supporting the communication- and publication activities? (please rate on a scale from 1 (not at all) to 5 (fully implemented)?,"If yes, please describe here:.1","Do you at faculty level work on introducing digital research methodologies (please rate on a scale from 1 (not at all) to 5 (fully implemented)? - Not yet and have no immediate plans
","Do you at faculty level work on introducing digital research methodologies (please rate on a scale from 1 (not at all) to 5 (fully implemented)? - Not yet, but plan to start relevant initiatives in the near future","Do you at faculty level work on introducing digital research methodologies (please rate on a scale from 1 (not at all) to 5 (fully implemented)? - Some institutes have initiated development, but have no common strategy in place",Do you at faculty level work on introducing digital research methodologies (please rate on a scale from 1 (not at all) to 5 (fully implemented)? - Have developed a common strategy and initiated competence development,Do you at faculty level work on introducing digital research methodologies (please rate on a scale from 1 (not at all) to 5 (fully implemented)? - Have a well-defined portfolio of initiatives and of labs to support the competence development ,"If you have additional remarks, please write them here:","Do any of your institutes or departments work on introducing digital research methodologies? (rate on a scale from 1 (not at all) to 5 (fully implemented)) - Not yet and have no immediate plans
","Do any of your institutes or departments work on introducing digital research methodologies? (rate on a scale from 1 (not at all) to 5 (fully implemented)) - Not yet, but plan to start relevant initiatives in the near future","Do any of your institutes or departments work on introducing digital research methodologies? (rate on a scale from 1 (not at all) to 5 (fully implemented)) - Yes, have initiated development, but no decision in place","Do any of your institutes or departments work on introducing digital research methodologies? (rate on a scale from 1 (not at all) to 5 (fully implemented)) - Yes, have developed a strategy and initiated an introduction","Do any of your institutes or departments work on introducing digital research methodologies? (rate on a scale from 1 (not at all) to 5 (fully implemented)) - Yes, have a well-defined portfolio of methodologies","If you have additional remarks, please write them here:.1",Would you be willing to share any of the following? (please mark all that apply),Do you offer competence development of Master-level students?,If yes: How is it implemented - Is the course part of the curriculum,If yes: How is it implemented - Are the courses of general or specialized nature? ,If yes: How is it implemented,Is DIGITAL methodology taught as an integrated part of the existing course or is it a separate course? ,Have you developed your own  course material?,What type?,By whom?,Would you be willing to share the course materials with WHOM?,"If you have developed the course material yourself, please list the name or the sources:","Please list courses offered in 2016-2018,  or add a link.","Do you have experience in offering competence development for students, which does not result in ECTS;  if yes, please share your experience (incl.pros/cons).","How do you at your university (or at, faculty or department level) support data management?","How do you at your university (or at, faculty or department level) support data management? - In case, you would like to share you outcome, please add an URL:","As part of training employees in Digital Humanities, do you offer online training course components ?",Are you aware of - or interested in using courses or course components from?,"Are you aware of - or interested in using courses or course components from? - Somebody else, please state:",Would you like to collaborate on identifying and sharing knowledge relevant for competence development within Humanities? ,"Any specific experiences you want to share with other relevant parties (such as Nordic partners, researchers and institutions)",Areas in which your department can contribute (core competences),Please list areas which you see as having potential for a broader Nordic collaboration ,"Name of research group, research center and/or department",Would you be interested in using such a sandbox?,"Are you offering competence development to build this kind of competences?  - Graphical representations and interpretations of data
","Are you offering competence development to build this kind of competences?  - Basic statistical understanding
","Are you offering competence development to build this kind of competences?  - Ethical questions arising in the digital world 
","Are you offering competence development to build this kind of competences?  - Importance of right management and of data protection
","Are you offering competence development to build this kind of competences?  - Cross sector terminology (e.g to allow a humanist to talk to a computer scientist or a statistician) 
",Other:,"As a research group or similar, how do you work with competence development?",Have you considered supercomputing in your work or do you collaborate with others that use HPC? ,Who are in charge of developing and running the course?,"Who are in charge of developing and running the course? - Other, please state: ",Do you offer separate courses or do you have the activities as an integrated part of the existing “normal” lectures?,"Please list the name of courses and competence development, which you think might be useful for others (list or include URL)?","Please list the course material, which has not already been mentioned, which you think is relevant for others and you are willing to share","The results of this project will be send to the responders, however, would you like to receive this directly?","The results of this project will be send to the responders, however, would you like to receive this directly? - Yes, please mail to"
Østfold University College,Yes,We have common practices at institutional levels that apply for our faculties,Yes,On insitutional levesl that apply for all faculties,1.0,2.0,,,,,,,,,,,,,,,,,,,,,,,,Have developed a policy and offer support for data management planning / Have a policy and offer a (5-10) year secure data storage solution to the researchers / Offer a solution which accounts for the requirement in the GDPR directive / Offer long term storage of data,,Mostly not,,,,,,,,,,,,,,,,,,,,,,,
